{"id": "171", "label": "AIA 171 \u00c5", "thumb": "thumb/rhef_171_thumb.png", "img1k": "1k/rhef_171_1k.png", "video": "video/rhef_171_1k.mp4", "updated": "2026-10-13T03:43:03Z", "frame_count": 144, "integration": {"frames": 5, "method": "median"}, "video_v": "v/171/20261013T032246.mp4", "still_v": "v/171/20261013T034303.png", "through": "2026-10-13T03:22:46Z"}